{
  "kind": "item",
  "id": "it.adrenaline-shot",
  "name": "Adrenaline Shot",
  "symbol": "medicine",
  "class": "wastePile",
  "play": {
    "effect": [
      {
        "op": "choose",
        "scope": {
          "who": "seat",
          "chooser": "owner"
        },
        "options": [
          {
            "id": "set1",
            "label": "Set a die to 1",
            "effect": [
              {
                "op": "modDie",
                "value": "set:1",
                "count": 1,
                "scope": {
                  "who": "seat"
                }
              }
            ]
          },
          {
            "id": "set2",
            "label": "Set a die to 2",
            "effect": [
              {
                "op": "modDie",
                "value": "set:2",
                "count": 1,
                "scope": {
                  "who": "seat"
                }
              }
            ]
          },
          {
            "id": "set3",
            "label": "Set a die to 3",
            "effect": [
              {
                "op": "modDie",
                "value": "set:3",
                "count": 1,
                "scope": {
                  "who": "seat"
                }
              }
            ]
          },
          {
            "id": "set4",
            "label": "Set a die to 4",
            "effect": [
              {
                "op": "modDie",
                "value": "set:4",
                "count": 1,
                "scope": {
                  "who": "seat"
                }
              }
            ]
          },
          {
            "id": "set5",
            "label": "Set a die to 5",
            "effect": [
              {
                "op": "modDie",
                "value": "set:5",
                "count": 1,
                "scope": {
                  "who": "seat"
                }
              }
            ]
          },
          {
            "id": "set6",
            "label": "Set a die to 6",
            "effect": [
              {
                "op": "modDie",
                "value": "set:6",
                "count": 1,
                "scope": {
                  "who": "seat"
                }
              }
            ]
          }
        ]
      }
    ]
  },
  "text": {
    "ability": "Set one of your unused action dice to any value you like."
  },
  "sources": {
    "symbol": "F 1.3.2; W",
    "class": "BGG card-spread; BGG ludopedia-51114",
    "play": "BGG card-spread; BGG ludopedia-51114"
  },
  "status": "draft",
  "notes": "src: items-sources.md Hospital / Adrenaline Shot (F 1.3.2)"
}
